时间,地点,核心人物,相关人物,事件类型,事件描述,原文出处,页码/位置,,,,,,,
1942 年 (民国三十一年壬午，七十九岁),北平,黄宾虹,无,艺术 / 题诗,新春为《家庆图》题诗，抒发思乡心绪,原文文档,不详,,,,,,,
1942 年 (民国三十一年壬午，七十九岁),北平蛰园,黄宾虹,瞿兑之、傅沅叔等,雅集 / 赋诗,春季北平众友人设宴为其贺寿，黄宾虹即席赋诗，友人相继步韵唱和,原文文档,不详,,,,,,,
1942 年 (民国三十一年壬午，七十九岁),北平,黄宾虹,苏君、画商,书画 / 临摹,购藏黄凤六临摹《黟山奇卉册》未果，后应藏家之请补全画作并题写长跋,原文文档,不详,,,,,,,
1942 年 (民国三十一年壬午，七十九岁),北平,黄宾虹,无,艺术 / 创作,初春取吴仲圭笔法绘制《杨铁崖诗意图》并题句,原文文档,不详,,,,,,,
1942 年 (民国三十一年壬午，七十九岁),北平,黄宾虹,佛画研究会众学员,社团 / 活动,二月佛画研究班更名佛画研究会并招收新生,原文文档,不详,,,,,,,
1942 年 (民国三十一年壬午，七十九岁),北平帅府园颐园饭庄,黄宾虹,齐白石、陈半丁、汪福熙等,义展 / 募资,二月七日与众友人联名发起汪采白遗作展，售卖所得悉数赠予汪采白之父汪福熙,原文文档,不详,,,,,,,
1942 年 (民国三十一年壬午，七十九岁),北平,黄宾虹,陆元同,文论 / 作序,三月为陆元同所辑《释石溪事迹汇编》撰写序言，该文刊载于《中和》月刊,原文文档,不详,,,,,,,
1942 年 (民国三十一年壬午，七十九岁),北平,黄宾虹,北平艺专,展览 / 参展,三月二十五日携个人古画藏品，参加北平艺专主办的古代美术展览会,原文文档,不详,,,,,,,
1942 年 (民国三十一年壬午，七十九岁),北平琼岛,黄宾虹,傅增湘,雅集 / 赋诗,暮春参加傅增湘举办的琼岛雅集，作《北海镜清斋补禊酬傅沅叔得郭字》一诗,原文文档,不详,,,,,,,
1942 年 (民国三十一年壬午，七十九岁),北平、福建建阳,黄宾虹,苏乾英,书信 / 赠画,夏季收到苏乾英来信，作画十帧托人转交，分赠当地友人，二人书信交流画学见解,原文文档,不详,,,,,,,
1942 年 (民国三十一年壬午，七十九岁),北平,黄宾虹,谈月色,文稿 / 作序,初冬为谈月色所辑《寒琼遗稿》撰写序言，并附书信往来,原文文档,不详,,,,,,,
1942 年 (民国三十一年壬午，七十九岁),北平,黄宾虹,黎母甘太夫人,艺术 / 创作,冬日绘制《南山瑞霭图》，为黎母甘太夫人庆贺寿辰,原文文档,不详,,,,,,,
1942 年 (民国三十一年壬午，七十九岁),北平,黄宾虹,无,金石 / 题跋,冬日为汉二十四字吉语砖拓本题写跋文,原文文档,不详,,,,,,,
1942 年 (民国三十一年壬午，七十九岁),北平,黄宾虹,吴载和,书信 / 悼亡,十二月三十日宣哲逝世，黄宾虹致信吴载和表达惋惜之情,原文文档,不详,,,,,,,
1942 年 (民国三十一年壬午，七十九岁),北平,黄宾虹,无,艺术 / 创作,本年创作《燕郊纪游图》、《李空同词意图》等作品,原文文档,不详,,,,,,,
1942 年 (民国三十一年壬午，七十九岁),北平,黄宾虹,许承尧,鉴藏 / 通信,本年提及偶然收得赵松雪画作与中峰禅师书法，与许承尧书信交流藏品心得,原文文档,不详,,,,,,,
1943 年 (民国三十二年癸未，八十岁),北平中山公园,黄宾虹,溥儒、周学熙等,展览 / 合影,一月一日参加华北居士林佛画研究会首届成绩展，与在场师友合影留念,原文文档,不详,,,,,,,
1943 年 (民国三十二年癸未，八十岁),北平,黄宾虹,段拭,书画 / 酬答,门生段拭寄书籍为其贺寿，黄宾虹绘制山水册页回赠并题跋,原文文档,不详,,,,,,,
1943 年 (民国三十二年癸未，八十岁),北平,黄宾虹,顾飞,书信 / 论画,年初致信顾飞，附笔法图，阐述自身绘画取法古人、自出机杼的创作理念,原文文档,不详,,,,,,,
1943 年 (民国三十二年癸未，八十岁),北平,黄宾虹,无,书法 / 创作,春季书写七言篆书对联留存,原文文档,不详,,,,,,,
1943 年 (民国三十二年癸未，八十岁),北平,黄宾虹,张秉三,艺术 / 创作,初夏为张秉三绘制细笔山水，收录于其六十寿纪念册中,原文文档,不详,,,,,,,
1943 年 (民国三十二年癸未，八十岁),北平,黄宾虹,傅增湘,文稿 / 赠诗,初夏誊录《八十感言》未定稿赠予傅增湘,原文文档,不详,,,,,,,
1943 年 (民国三十二年癸未，八十岁),北平,黄宾虹,周养庵,书画 / 题跋,夏季为周养庵所藏《黟山奇卉册》临摹题跋，转录前人题识,原文文档,不详,,,,,,,
1943 年 (民国三十二年癸未，八十岁),北平,黄宾虹,无,艺术 / 创作,夏季绘制太湖题材《太湖帆影》扇面并题字,原文文档,不详,,,,,,,
1943 年 (民国三十二年癸未，八十岁),北平,黄宾虹,郭味蕖,文稿 / 作序,夏季为郭味蕖编撰的《宋元明清书画家年表》撰写序言,原文文档,不详,,,,,,,
1943 年 (民国三十二年癸未，八十岁),北平、上海,黄宾虹,傅雷、顾飞、裘柱常,书信 / 订交,五月起经顾飞介绍与傅雷互通书信，二人论辩画理、探讨中国画发展，结为忘年知音,原文文档,不详,,,,,,,
1943 年 (民国三十二年癸未，八十岁),北平,黄宾虹,傅雷,艺术 / 创作,七月七日绘制《青城山》图册十二帧赠予傅雷，并为每帧画作逐一题跋,原文文档,不详,,,,,,,
1943 年 (民国三十二年癸未，八十岁),北平,黄宾虹,陈隽甫、吴咏香、顾飞,社交 / 交往,六七月间陈隽甫赴香港与吴咏香成婚，途经上海，黄宾虹致信顾飞夫妇请其代为照拂，并在信中阐述画学理念，提出美在内不在外,原文文档,不详,,,,,,,
1943 年 (民国三十二年癸未，八十岁),北平,黄宾虹,裘柱常,书信 / 论画,致信裘柱常，探讨书画艺术，提出作画需遵循准则、崇尚自然，区分画作上、中、下三品，阐明用笔的重要性,原文文档,不详,,,,,,,
1943 年 (民国三十二年癸未，八十岁),北平,黄宾虹,石谷风,授艺 / 教学,夏季门生石谷风从济南前来求教笔法，黄宾虹演示转笔法，并赠予 “虚中运实，柔内含刚” 八字笔法诀,原文文档,不详,,,,,,,
1943 年 (民国三十二年癸未，八十岁),北平,黄宾虹,石谷风、张海清,社交 / 交往,经石谷风介绍，铁路工人张海清慕名索画，常年为缺粮的黄宾虹运送大米，累计获画作百幅，将居所命名为 “百黄斋”,原文文档,不详,,,,,,,
1943 年 (民国三十二年癸未，八十岁),北平,黄宾虹,郑履端,书信 / 论画,致信郑履端，交流籀篆书法与绘画用笔，讲解转笔、布白等技法要点,原文文档,不详,,,,,,,
1943 年 (民国三十二年癸未，八十岁),北平,黄宾虹,无,艺术 / 创作,长夏时节绘制太湖山水扇面，并题字记述游历经历,原文文档,不详,,,,,,,
1943 年 (民国三十二年癸未，八十岁),北平、济南,黄宾虹,谢天民、石谷风、路大荒,社交 / 交往,秋季谢天民与石谷风在济南举办双人画展，路大荒托二人捎来两方五石顶烟墨赠予黄宾虹,原文文档,不详,,,,,,,
1943 年 (民国三十二年癸未，八十岁),北平,黄宾虹,汪慎生、邱石冥、瞿兑之、容庚,雅集 / 创作,秋日与汪慎生、邱石冥等人于园中共聚吟诗，合作绘制《集瑞图》，众人分别补绘景物并题款,原文文档,不详,,,,,,,
1943 年 (民国三十二年癸未，八十岁),北平,黄宾虹,童大年,社交 / 交往,九月二十六日秋分后三日，童大年作《眉寿图》为黄宾虹庆贺八十大寿，并致信求书法作品及润格,原文文档,不详,,,,,,,
1943 年 (民国三十二年癸未，八十岁),北平、上海,黄宾虹,傅雷,文论 / 传播,九月傅雷撰写《观画答客问》阐释黄宾虹画理，该文被删改套语后用作艺术专科学校讲义,原文文档,不详,,,,,,,
1943 年 (民国三十二年癸未，八十岁),北平,黄宾虹,顾飞,文论 / 整理,门生顾飞辑录黄宾虹画论成《论画鳞爪》，刊载于画展特刊,原文文档,不详,,,,,,,
1943 年 (民国三十二年癸未，八十岁),上海,黄宾虹,傅雷、裘柱常、顾飞、马公愚,展览 / 活动,十一月十九日至二十三日，众人在上海宁波同乡会筹办黄宾虹书画展，马公愚题写展名，傅雷全权操办展览事务，画展观者云集、售出画作一百六十件,原文文档,不详,,,,,,,
1943 年 (民国三十二年癸未，八十岁),上海,黄宾虹,夏丏尊、傅雷,社交 / 嘱托,十一月二十九日，夏丏尊委托傅雷代为恳请黄宾虹重绘《晚晴山房图》以纪念弘一法师,原文文档,不详,,,,,,,
1943 年 (民国三十二年癸未，八十岁),上海,黄宾虹,王秋湄、陈叔通等友人,社交 / 答谢,十二月五日，黄宾虹在秦更年家中设素席，答谢参与画展的诸位友人,原文文档,不详,,,,,,,
1943 年 (民国三十二年癸未，八十岁),北平,黄宾虹,徐丹甫,社交 / 书信,十二月八日徐丹甫致信黄宾虹，索要画册并请教题签笔墨、章法技巧,原文文档,不详,,,,,,,
1943 年 (民国三十二年癸未，八十岁),北平,黄宾虹,翁纫秋,艺术 / 创作,冬季为翁纫秋创作《万松峦翠图》长卷,原文文档,不详,,,,,,,
1943 年 (民国三十二年癸未，八十岁),北平,黄宾虹,曹熙宇,艺术 / 创作,创作山水横披，题诗为曹熙宇四十寿辰祝寿,原文文档,不详,,,,,,,
无,黄宾虹,汪福熙,人物 / 逝世,本年汪福熙离世，享年八十三岁,原文文档,不详,,,,,,,,
1944 年 (民国三十三年甲申，八十一岁),北平,黄宾虹,许承尧,艺术 / 创作,年初绘制《黄山松图》，题诗为许承尧七十寿辰祝寿,原文文档,不详,,,,,,,
1944 年 (民国三十三年甲申，八十一岁),北平,黄宾虹,顾飞,书信 / 论画,年初致信顾飞，谈及近期绘画取法，称作品参唐法而以元人为旨归,原文文档,不详,,,,,,,
1944 年 (民国三十三年甲申，八十一岁),上海,黄宾虹,徐朗西、余空我等,展览 / 活动,一月八日汪声远国画个展于上海宁波同乡会开幕，黄宾虹与众人共同担任展览发起人,原文文档,不详,,,,,,,
1944 年 (民国三十三年甲申，八十一岁),北平,黄宾虹,刘凌沧、邱石冥等艺专同人,雅集 / 创作,一月十一日，北平艺专同人邀约黄宾虹在中山公园作画祝寿，黄宾虹题诗留念，后续又重题诗句,原文文档,不详,,,,,,,
1944 年 (民国三十三年甲申，八十一岁),北平,黄宾虹,伊京、黑田,社交 / 拒斥,北平艺专辅佐官伊京、黑田提议为黄宾虹举办祝寿仪式与画展，均被其婉言拒绝,原文文档,不详,,,,,,,
1944 年 (民国三十三年甲申，八十一岁),北平,黄宾虹,许承尧,社交 / 贺寿,许承尧作诗《黄宾虹八十生日诗》，为黄宾虹庆贺寿辰,原文文档,不详,,,,,,,
1944 年 (民国三十三年甲申，八十一岁),北平,黄宾虹,黄嘉德,社交 / 书信,一月二十日黄嘉德致信贺寿并赠送祝寿礼品，二月七日再次来信托其绘制山水屏条,原文文档,不详,,,,,,,
1944 年 (民国三十三年甲申，八十一岁),北平,黄宾虹,陈叔通,社交 / 书画赠予,一月下旬陈叔通先后两度致信求索山水册页，黄宾虹为其绘制《阳朔山水》相赠,原文文档,不详,,,,,,,
1944 年 (民国三十三年甲申，八十一岁),北平,黄宾虹,琉璃厂店家,游历 / 创作,一月二十五日春节当日游览琉璃厂，晚间作画回赠北平艺专祝寿同人,原文文档,不详,,,,,,,
1944 年 (民国三十三年甲申，八十一岁),北平,黄宾虹,高燮,艺术 / 创作,春季为高燮绘制《闲闲山庄图》并题诗，高燮作诗回赠并致信交流收藏、艺事相关内容,原文文档,不详,,,,,,,
1944 年 (民国三十三年甲申，八十一岁),重庆,黄宾虹,陆丹林,传闻 / 悼文,陆丹林听闻黄宾虹离世讹传，于二月十三日在《扫荡报》发表《感悼黄宾虹画人》追忆二人过往,原文文档,不详,,,,,,,
1944 年 (民国三十三年甲申，八十一岁),北平,黄宾虹,瞿宣颖,文论 / 刊载,二月十六日《古今》半月刊刊载瞿宣颖所作《宾虹论画》，评述黄宾虹的艺术理念与为人,原文文档,不详,,,,,,,
1944 年 (民国三十三年甲申，八十一岁),北平,黄宾虹,王秋湄,人物 / 悼亡,三月十六日王秋湄病逝，黄宾虹闻讯十分悲痛，傅雷致信告知详情,原文文档,不详,,,,,,,
1944 年 (民国三十三年甲申，八十一岁),北平,黄宾虹,于希宁,金石 / 篆刻,四月于希宁为黄宾虹刻制 “黄宾虹之玺”“黄予向” 两方白文印章,原文文档,不详,,,,,,,
1944 年 (民国三十三年甲申，八十一岁),北平,黄宾虹,姚光,艺术 / 创作、社交,五月为姚光绘制《怀旧楼校书图》并题诗，姚光致信致谢并汇赠笔墨资费,原文文档,不详,,,,,,,
1944 年（甲申，八十一岁）,北平,黄宾虹,无,画论 / 创作,撰写《画学臆谈》，系统阐释用笔、墨、章法三大画学要义,《画学臆谈》,不详,,,,,,,
1944 年（甲申，八十一岁）,北平,黄宾虹,陈隽甫、吴咏香,参展 / 交流,7 月 11 日，门生陈隽甫、吴咏香在天津举办夫妇书画联展,《华北新报》1944 年 7 月 5 日,不详,,,,,,,
1944 年（甲申，八十一岁）,北平,黄宾虹,友人,画论 / 立论,7 月 14 日撰写《画法臆谈・总论》，将 “丑中有美” 的审美理念引入画学范畴,《画法臆谈・总论》,不详,,,,,,,
1944 年（甲申，八十一岁）,北平,黄宾虹,傅雷,书信 / 论艺,7 月 24 日收到傅雷来信，二人往复书信畅谈中西画理异同、绘画工具变革,往来书信,不详,,,,,,,
1944 年（甲申，八十一岁）,北平,黄宾虹,秦更年,艺术 / 创作,夏季为秦更年绘制《江淮纪游图》并题款,画作自题,不详,,,,,,,
1944 年（甲申，八十一岁）,北平,黄宾虹,金禹民,题跋 / 交游,夏季为雪庐画社导师金禹民题《印存》,题跋文字,不详,,,,,,,
1944 年（甲申，八十一岁）,北平,黄宾虹,王石之、邱石冥等,笔谈 / 论艺,8 月受邀参与《华北新报》“改良国画问题” 笔谈，驳斥附合时局的创作论调,1944 年 8 月 4 日、11 日、18 日《华北新报》,不详,,,,,,,
1944 年（甲申，八十一岁）,北平,黄宾虹,方叔轩、邓只淳,艺术 / 交流,作画赠予四川方叔轩、邓只淳，方叔轩来信探讨石涛画学,往来书信,不详,,,,,,,
1944 年（甲申，八十一岁）,北平,黄宾虹,朱砚因,书信 / 画论,秋季致朱砚因书信，提出咸同时期画作水准优于明代，“道咸画学中兴” 观点初步形成,往来书信,不详,,,,,,,
1944 年（甲申，八十一岁）,北平,黄宾虹,邓实,艺术 / 创作,10 月 25 日（重九）作《风雨楼图》横披赠予邓实并题诗,1998 年 5 月 1 日《大公报》,不详,,,,,,,
1944 年（甲申，八十一岁）,北平,黄宾虹,胡佩衡、陈半丁等,参会 / 应酬,10 月 30 日被日方邀约出席 “中日画家恳谈会”,相关报道,不详,,,,,,,
1944 年（甲申，八十一岁）,北平,黄宾虹,刘介一,参展 / 序文,11 月 3 日为刘介一画展撰写《刘介一画展小言》，并携作品一同参展,1944 年 11 月 3 日、6 日《华北新报》,不详,,,,,,,
1944 年（甲申，八十一岁）,北平,黄宾虹,于非厂等,参展 / 交流,11 月 11 日，作品参与古物陈列所国画研究院师生画展,1944 年 11 月 2 日《华北新报》,不详,,,,,,,
1944 年（甲申，八十一岁）,北平,黄宾虹,王雪涛,艺术 / 创作,12 月 27 日作画为王雪涛贺寿,香港佳士得 2005 年秋拍图录,不详,,,,,,,
1944 年（甲申，八十一岁）,北平,黄宾虹,许承尧,追忆 / 评述,本年许承尧作《忆宾虹》一文，评价其学识、书画与篆刻,《许疑盦先生年谱（初稿）》,不详,,,,,,,
1944 年（甲申，八十一岁）,北平,黄宾虹,汪勖予,艺术 / 创作,本年作画并题跋邮寄赠予汪勖予,画作自题,不详,,,,,,,
1945 年（乙酉，八十二岁）,北平,黄宾虹,无,行事 / 润例,岁首物价飞涨，订立《虹庐润例》规范书画酬价,《虹庐润例》,不详,,,,,,,
1945 年（乙酉，八十二岁）,北平,黄宾虹,许承尧,艺术 / 馈赠,1 月应许承尧请求，挑选十二帧临古画稿寄赠其子女用作学画范本,许承尧书信、题诗,不详,,,,,,,
1945 年（乙酉，八十二岁）,北平,黄宾虹,赫宠恩,聘任 / 事务,2 月 20 日聘请赫宠恩担任常年法律顾问,聘任文书、查永玲相关著作,不详,,,,,,,
1945 年（乙酉，八十二岁）,北平,黄宾虹,方叔轩,艺术 / 创作,1947 年春应方叔轩请求，绘制山水横披,往来书信,不详,,,,,,,
1945 年（乙酉，八十二岁）,北平,黄宾虹,陈叔通,艺术 / 馈赠,春季以十二帧阳朔山水册寄赠陈叔通,陈叔通往来书信,不详,,,,,,,
1945 年（乙酉，八十二岁）,北平,黄宾虹,无,悼念 / 记事,4 月 28 日，赵叔孺病逝，记录此事,存考资料,不详,,,,,,,
1945 年（乙酉，八十二岁）,北平,黄宾虹,傅雷,书信 / 酬答,6 月 19 日收到傅雷来信，对方致谢并品评画作，转达陈陶遗问候,往来书信,不详,,,,,,,
1945 年（乙酉，八十二岁）,北平,黄宾虹,历代画论作者,艺术 / 创作,夏季创作山水册八开，摘录历代画论题于册页之上,画作自题,不详,,,,,,,
1945 年（乙酉，八十二岁）,北平,黄宾虹,张尔康、祁森焕,任职 / 受聘,8 月被国立北京师范大学聘为教育学院工艺系讲师，聘期一年,国立北京师范大学聘书,不详,,,,,,,
1945 年（乙酉，八十二岁）,北平,黄宾虹,无,纪事 / 治印,8 月听闻日军投降，刻 “冰上鸿飞馆” 闲章，筹划南归,闲章考释资料,不详,,,,,,,
1945 年（乙酉，八十二岁）,北平,黄宾虹,夏蓝田、赫宠恩,讼事 / 迁居,10 月 16 日遭房东夏蓝田起诉，由律师赫宠恩代为应诉,《杂记》、复房东信函,不详,,,,,,,
1945 年（乙酉，八十二岁）,北平,黄宾虹,黄居素,书信 / 近况,致黄居素书信，讲述北平物价、租房困境与日常创作状态,往来书信,不详,,,,,,,
1945 年（乙酉，八十二岁）,北平,黄宾虹,龙樵等多人,题跋 / 鉴藏,为龙樵山水作品题跋，齐白石、邵章等亦相继题识,拍卖图录、题跋文字,不详,,,,,,,
1945 年（乙酉，八十二岁）,北平,黄宾虹,方药雨、陈邦怀,艺术 / 题跋,冬季与方药雨合作绘制齐阳罍全形拓配画，陈邦怀为题字,雅昌网藏品资料,不详,,,,,,,
1945 年（乙酉，八十二岁）,北平,黄宾虹,无,艺术 / 讽喻,创作《财神图》，以画作讽刺战后贪腐官吏,画作自题、私人藏品资料,不详,,,,,,,
1946 年（丙戌，八十三岁）,北平,黄宾虹,许承尧,艺术 / 创作,新春为许承尧创作水墨山水图并题款,安徽省博物馆藏品,不详,,,,,,,
1946 年（丙戌，八十三岁）,北平,黄宾虹,黄萍荪,书信 / 酬答,2 月 13 日收到黄萍荪来信，对方恳请再次赐画,往来书信,不详,,,,,,,
1946 年（丙戌，八十三岁）,北平,黄宾虹,张继、张半陶、齐白石等,参会 / 交往,3 月 12 日出席故都文物研究会成立大会，与诸多书画名家合影,《故都旬刊》第 3 期,不详,,,,,,,
1946 年（丙戌，八十三岁）,北平,黄宾虹,张伯驹,艺术 / 创作,上巳日（4 月 4 日）参与禊集，作《春山春水图》横披,2008 年朵云轩秋拍图录,不详,,,,,,,
1946 年（丙戌，八十三岁）,北平、福建,黄宾虹,俞剑华,书信 / 问候,4 月收到俞剑华自上海寄来的问候信函,往来书信,不详,,,,,,,
1946 年（丙戌，八十三岁）,北平,黄宾虹,鲍君白,艺术 / 创作,4 月为鲍君白新建读书楼绘制《读书楼图》并题款,往来书信、画作自题,不详,,,,,,,
1946 年（丙戌，八十三岁）,北平,黄宾虹,傅雷,书信 / 论艺,4 月 8 日致傅雷书信，讲述时局心绪影响创作，画作越画越浑厚浓重,往来书信,不详,,,,,,,
1946 年（丙戌，八十三岁）,北平,黄宾虹,无,艺术 / 临摹,5 月 6 日（立夏）临摹《富春山居图》并题写款识,画作自题,不详,,,,,,,
1946 年（丙戌，八十三岁）,北平、澳门,黄宾虹,黄居素,艺术 / 创作,初夏为黄居素作《海印盦图卷》并赋诗题跋,往来书信、画作自题,不详,,,,,,,
1946 年（丙戌，八十三岁）,北平,黄宾虹,孙会元,艺术 / 创作,夏日为孙会元宣和齋开业作《萱花百合图》，徐石雪、陶北溟等题跋,画作及题跋,不详,,,,,,,
1946 年（丙戌，八十三岁）,北平,黄宾虹,海外学者,画论 / 交流,谈及自身取法北宋，认为宋元画作笔墨与西方绘画理念相通,往来书信,不详,,,,,,,
1946 年（丙戌，八十三岁）,北平,黄宾虹,张半陶,编刊 / 撰文,7 月受聘为《故都》旬刊襄理，为刊物撰写文稿,往来书信、《故都旬刊》,不详,,,,,,,
1946 年（丙戌，八十三岁）,北平,黄宾虹,无,迁居 / 记事,夏季迁居石驸马后宅三十五号，搬迁途中遗失大量古今书画,往来书信,不详,,,,,,,
1946 年（丙戌，八十三岁）,北平、歙县,黄宾虹,许承尧,悼念 / 撰文,7 月 6 日许承尧病逝，黄宾虹作诔文悼念,往来书信,不详,,,,,,,
1946 年（丙戌，八十三岁）,北平,黄宾虹,林散之,书信 / 往来,7 月、9 月两度收到林散之来信，师徒互通音讯,往来书信,不详,,,,,,,
1946 年（丙戌，八十三岁）,北平,黄宾虹,鲍君白,书信 / 论艺,秋季致鲍君白书信，畅谈画学理念、咸同画坛与中西艺术发展,往来书信,不详,,,,,,,
1946 年（丙戌，八十三岁）,北平、南京,黄宾虹,陈中凡,艺术 / 创作,秋日收到陈中凡来信，作《蜀游山水》相赠并题跋,往来书信、画作自题,不详,,,,,,,
1946 年（丙戌，八十三岁）,北平,黄宾虹,徐悲鸿,任职 / 受聘,8 月受徐悲鸿邀请，在国立北平艺专担任国画理论教授,往来书信,不详,,,,,,,
1946 年 (丙戌，八十三岁),北平,黄宾虹,黄羲,书信 / 求教,七月望后二日收到黄羲来信，对方自述在集美学校任教的境遇，询问黄宾虹南归计划并恳请赐书画、指点画艺，同时打听多位旧友消息,往来书信,不详,,,,,,,
1946 年 (丙戌，八十三岁),北平,黄宾虹,张继、张半陶,鉴藏 / 参展,9 月 25 日将 23 件珍藏借予故都文物研究会，用于 9 月 26 日开幕的临时文物展，研究会出具正式收据,故都文物研究会收据、张半陶《故都文物研究會之經過及未來展望》,不详,,,,,,,
1946 年 (丙戌，八十三岁),北平,黄宾虹,张继、张半陶,任职 / 婉拒,故都文物研究会推举其担任文献馆（美术馆）馆长，黄宾虹明确拒绝该职务,与朱砚英往来书信,不详,,,,,,,
1946 年 (丙戌，八十三岁),北平、上海、南京,黄宾虹,齐白石、溥心畬、张半陶,参展 / 创作,10 月中旬受故都文物研究会邀约，携作品参与齐白石、溥心畬联合画展，展览于 11 月在上海、南京举办,1946 年 11 月 10 日《申报》画展广告,不详,,,,,,,
1946 年 (丙戌，八十三岁),上海,黄宾虹,傅雷,评论 / 交流,11 月 29 日傅雷致信，点评此次联展多位画家作品，谈及画坛乱象,往来书信,不详,,,,,,,
1946 年 (丙戌，八十三岁),上海,黄宾虹,施翀鹏,评论 / 论艺,施翀鹏发文直言批评黄宾虹参展作品笔墨杂乱、画面晦暗，该文为民国时期少见的直面其画作的评论文章,1947 年《藝術論壇》創刊號,不详,,,,,,,
1946 年 (丙戌，八十三岁),北平、上海,黄宾虹,江振华,书信 / 索画,江振华自新加坡返沪组建黄山文艺社，多次致信索画用于陈列，黄宾虹陆续寄送书画、篆联予以支持,往来书信,不详,,,,,,,
1946 年 (丙戌，八十三岁),北平,黄宾虹,吴鸣 (仲鸣),艺术 / 创作,应澳门吴鸣之邀创作《挹翠閣圖》并自题画款，二人书信交流澳门风物、旧居往事,《黄賓虹先生畫集》、《黄賓虹書信墨迹》,不详,,,,,,,
1946 年 (丙戌，八十三岁),北平,黄宾虹,陈景昭,治学 / 考据,潜心考释东周七国古文字，搜集古印、砖瓦、钱币等器物上的异体文字，撰写相关文稿,与陈景昭往来书信,不详,,,,,,,
1946 年 (丙戌，八十三岁),北平,黄宾虹,齐白石,题跋 / 交游,为齐白石《鐵拐李圖》题写画跋，品评其减笔人物画的艺术渊源与造诣,2009 年春保利拍賣圖錄,不详,,,,,,,
1946 年 (丙戌，八十三岁),北平,黄宾虹,诸亲友门生,家事 / 应酬,当年子女婚嫁，众多旧友、门生纷纷前来索书索画，日常事务十分繁忙,致友人门生书信,不详,,,,,,,
1947 年 (丁亥，八十四岁),北平,黄宾虹,黄树滋,行事 / 操守,2 月 7 日致信黄树滋，提及北平物价飞涨，自己作画择人而授，不与张大千、齐白石等人争抢名利,往来书信,不详,,,,,,,
1947 年 (丁亥，八十四岁),北平,黄宾虹,陈叔通,书信 / 问候,1 月 5 日收到陈叔通来信，对方关切其生计、藏品与著述出版事宜，并点评张大千的画作风格,往来书信,不详,,,,,,,
1947 年 (丁亥，八十四岁),北平、香港,黄宾虹,黄居素,书信 / 论画,初春致信返港的黄居虹，交流绘画心得，品评明清诸家及道咸时期画家，同时谈及返乡南归的想法,往来书信,不详,,,,,,,
