时间,地点,核心人物,相关人物,事件类型,事件描述,原文出处,页码/位置,,,,,,,
1865年(清穆宗同治四年 乙丑),浙江金华县城西铁岭头,黄宾虹,黄德涵、潘氏、黄定华、方氏,出生/家庭,1月27日子时出生，按旧俗落地记为二岁，星命家按甲子年、丁丑月、丁酉日、庚子推演命理，全家此前为避战乱迁居此地,《自撰年谱稿》《八十感言》《九十自述》,不详,,,,,,,
1865年(清穆宗同治四年 乙丑),浙江金华县城西铁岭头,黄宾虹,无,艺术/创作,因居所旁双溪水名瀔水，后获古玉印，撰写《释瀔篇》收录于《古印文字考》（未刊行），并将居室命名为穀玉堂,《自撰年谱稿》,不详,,,,,,,
1865年(清穆宗同治四年 乙丑),浙江金华县城西铁岭头,黄宾虹,无,艺术/创作,篆刻两方自用印，印文分别为“甲子年乙丑元旦生”“生於甲子”,《自撰年谱稿》,不详,,,,,,,
1865年(清穆宗同治四年 乙丑),浙江金华,黄宾虹,无,出生/家庭,本名懋质，一名元吉，后陆续更名、改字、改号，民国丁戊年间定字宾虹并沿用,《黄氏家谱》《八十自叙》《自撰生平简述》,不详,,,,,,,
1865年(清穆宗同治四年 乙丑),浙江金华,黄宾虹,黄赓、黄贡、黄赞,家庭/亲属,家族行辈为“懋”字，兄弟四人，当地墓碑记载均简写单名,《自撰年谱稿》,不详,,,,,,,
1865年(清穆宗同治四年 乙丑),浙江金华,黄宾虹,黄德涵、潘氏、黄定华、方氏,家庭/亲属,出生时祖父黄德ha离世十九年，祖母潘氏离世三年，父亲黄定华三十五岁，生母方氏二十三岁,《歙潭渡黄氏先德录》,不详,,,,,,,
1866年(清穆宗同治五年 丙寅),浙江金华,黄宾虹,黄赓,家庭/亲属,二弟黄赓（谱名懋赓）出生,《自撰年谱稿》,不详,,,,,,,
1866年(清穆宗同治五年 玉泉庵后兴让坊),黄宾虹,黄定华,家庭/亲属,全家从铁岭头迁居至县城玉泉庵后兴让坊,《自撰年谱稿》,不详,,,,,,,,
1866年(清穆宗同治五年 巷西蒋氏宅前通街),黄宾虹,黄定华、蒋宪章、金志甫、蒋廷烈、蒋莲芝,家庭/亲属,再次迁居巷西蒋氏宅前通街，父亲开设广达布总号，日常与邻里孩童一同玩耍,《自撰年谱稿》,不详,,,,,,,,
1866年(清穆宗同治五年 丙寅),浙江金华,黄宾虹,黄定华,学业/求学,时年三岁，开始接受父亲的庭训教导,《自撰年谱稿》《歙潭渡黄氏先德录》,不详,,,,,,,
1867年(清穆宗同治六年 丁卯),浙江金华,黄宾虹,黄定华,艺术/创作,时年四岁，开始学画，父亲握其手腕教画梅枝竹叶，旁人评价其颇具绘画悟性,王谱,不详,,,,,,,
1868年(清穆宗戊辰),浙江金华黄氏家塾,黄宾虹,邵赋清、黄定华,学业/求学,家中聘请邵赋清讲授《四子书》，父亲亲自督导，本人勤学好问,《歙潭渡黄氏先德录》,不详,,,,,,,
1868年(清穆宗戊辰),浙江金华,黄宾虹,黄定华,学业/求学,跟随父亲学习《说文解字》，初识六书文字之学,《歙潭渡黄氏先德录》《识字一首》,不详,,,,,,,
1869年(清穆宗己巳),浙江金华山罗店,黄宾虹,黄定华,游历/出行,因地方动乱，跟随父亲避乱至金华山罗店，家中延请蒙师启蒙,《八十自述》,不详,,,,,,,
1869年(清穆宗己巳),浙江金华山罗店,黄宾虹,倪逸甫,艺术/创作,课暇喜爱观摩图画、模仿作画，向倪逸甫请教画理，习得“当如作字法，笔笔宜分明”的作画准则,《八十自述》《杂稿》,不详,,,,,,,
1869年(清穆宗己巳),浙江金华山罗店,黄宾虹,倪逸甫,艺术/创作,聆听倪逸甫讲解书法要义，理解用笔需扎实、摒弃轻浮习气,《杂稿》,不详,,,,,,,
1869年(清穆宗己巳),浙江金华山罗店,黄宾虹,无,艺术/创作,临摹家中白石翁画册，坚持学习数年未曾中断,《八十自述》,不详,,,,,,,
1869年(清穆宗己巳),金华北山三洞,黄宾虹,李灼先、李咏棠,游历/出行,跟随两位业师游览昭真、双龙、冰壶三洞，观赏山水与钟乳景观,汪谱《九十杂述》,不详,,,,,,,
1869年(清穆宗己巳),金华山憩园,黄宾虹,李灼先,学业/求学,居于李灼先的憩园，阅读其家中藏书,汪谱《九十杂述》,不详,,,,,,,
1869年(清穆宗己巳),金华山智者寺,黄宾虹,李灼先、李咏棠,游历/出行,游览智者，观摩陆游书写的诗碑,《九十杂述》,不详,,,,,,,
1869年(清穆宗己巳),金华赤松宫,黄宾虹,李灼先、李咏棠,游历/出行,游览赤松宫，探访黄初平叱石成羊的古迹,《九十杂述》,不详,,,,,,,
1870年(清穆宗庚午),浙江金华,黄宾虹,黄贡,家庭/亲属,三弟黄贡（谱名懋贡）出生,《自撰年谱稿》《歙潭渡黄氏先德录》,不详,,,,,,,
1870年(清穆宗庚午),浙江金华黄氏家塾,黄宾虹,邵赋清,学业/求学,继续跟随邵赋清修习《四子书》，可查阅《字汇》，识字达千余,《自撰年谱稿》《九十杂述》,不详,,,,,,,
1870年(清穆宗庚午),浙江金华,黄宾虹,无,艺术/创作,每日坚持作画两小时，该习惯保持终身,《夏承焘集·天風閣學詞日記》,不详,,,,,,,
1871年(清穆宗辛未),浙江金华,黄宾虹,黄赞,家庭/亲属,四弟黄赞（谱名懋赞）出生,《自撰年谱稿》,不详,,,,,,,
1871年(清穆宗辛未),浙江金华八咏楼,黄宾虹,黄定华、黄崇惺,社交/交往,陪同父亲与黄崇同游八咏楼，诗词问答应对，得到对方赞赏,《自撰年谱稿》,不详,,,,,,,
1871年(清穆宗辛未),浙江金华黄氏家塾,黄宾虹,黄崇惺、程健行,学业/求学,黄崇惺远赴福建后，举荐程健行前来家中授课,《自撰年谱稿》,不详,,,,,,,
1871年(清穆宗辛未),浙江金华,黄宾虹,黄崇惺,学业/求学,收到黄崇惺从福建寄来的《劝学赘言》《凤山笔记》《潭渡杂志》等书籍，潜心研读,《自撰年谱稿》《歙潭渡黄氏先德录》,不详,,,,,,,
1872年(清穆宗壬申),浙江金华黄氏家塾,黄宾虹,程健行,学业/求学,跟随程健行学习《四子书》《五经》，具备独立思考能力,《与汪达川书》,不详,,,,,,,
1873年(清穆宗癸酉),浙江金华,黄宾虹,无,家庭/亲属,长妹出生，后早年夭折,《自撰年谱稿》,不详,,,,,,,
1873年(清穆宗癸酉),浙江金华,黄宾虹,黄定华、倪易甫,艺术/创作,奉父亲之命，临摹倪易甫所作《松菊图》,王谱,不详,,,,,,,
1873年(清穆宗癸酉),浙江杭州,黄宾虹,黄定华,游历/出行,跟随父亲游览杭州，沿途写生，观摩王蒙山水画并反复临摹,王谱,不详,,,,,,,
1873年(清穆宗癸酉),浙江杭州,黄宾虹,黄定华、应芷宾,学业/求学,遵父命留在杭州，跟随应芷宾求学，课余游览山水写生,王谱,不详,,,,,,,
1874年(清穆宗甲戌),浙江金华,黄宾虹,无,家庭/亲属,春季从杭州返回金华,《自撰年谱稿》,不详,,,,,,,
1874年(清穆宗甲戌),浙江金华,黄宾虹,黄白山、黄春谷,学业/求学,研读族祖黄白山《字诂》、黄春谷《梦陔堂文说》《经说》等著作,汪谱,不详,,,,,,,
1874年(清穆宗甲戌),浙江金华,黄宾虹,邓石如、丁敬,艺术/创作,开始学习篆刻，偷偷临摹邓石如印章十余方,王伯敏《黄宾虹》,不详,,,,,,,
1875年(清穆宗乙亥),浙江金华,黄宾虹,赵经田、应芹生、李咏棠、李灼先,学业/求学,时年十二岁，修习五经之余，兼学诗文、书法、绘画,《自撰年谱稿》,不详,,,,,,,
1875年(清穆宗乙亥),浙江金华,黄宾虹,祁寅,学业/求学,借阅明代画册与画论书籍，潜心钻研绘画技法,王谱,不详,,,,,,,
1876年(清穆宗丙子),安徽歙县,黄宾虹,无,学业/求学,早春返乡参加童子试，成绩名列前茅,黄警吾《黄賓虹在徽州》,不详,,,,,,,
1876年(清穆宗丙子),安徽歙县,黄宾虹,董其昌、查士标,艺术/创作,阅览当地名家书画真迹，临摹董其昌、查士标作品数年,《自叙》,不详,,,,,,,
1876年(清穆宗丙子),安徽歙县,黄宾虹,江永、戴震,学业/求学,阅读江永、戴震及族祖相关著作，开始钻研经史,《自述》,不详,,,,,,,
1877年(清穆宗丁丑),安徽歙县,黄宾虹,黄赓,学业/求学,与二弟一同参加府试，成绩位列高等,《洪孺夫人行狀略述》,不详,,,,,,,
1877年(清穆宗丁丑),安徽洪坑,黄宾虹,黄石珊、洪荩臣,社交/交往,跟随黄石珊拜访洪荩臣，结识当地名士,《洪孺夫人行狀略述》,不详,,,,,,,
1878年(戊寅),安徽歙县潭渡村,黄宾虹,族人,其他,寄居二伯父家中，跟随族人学习拳术、剑术、马术,汪谱,不详,,,,,,,
1878年(戊寅),安徽虬村,黄宾虹,汪溶,艺术/创作,前往虬村观赏汪溶所藏石涛《黄山图》，夜间凭记忆作画临摹,王谱,不详,,,,,,,
1879年(己卯),浙江金华,黄宾虹,无,学业/求学,春季返回金华，考入丽正书院并任职，以津贴购置画具,汪谱,不详,,,,,,,
1879年(己卯),浙江金华,黄宾虹,蒋莲僧,艺术/创作,与蒋莲僧一同研习山水画,王伯敏《黄賓虹》,不详,,,,,,,
1879年(己卯),浙江义乌,黄宾虹,陈春帆,艺术/创作,跟随义乌画师陈春帆学习人物画，随其游历义乌写生,《九十雜述》,不详,,,,,,,
1880年(庚辰),安徽歙县,黄宾虹,无,学业/求学,春季返乡参加院试，考中秀才,黄警吾《黄賓虹在徽州》,不详,,,,,,,
1880年(庚辰),浙江金华,黄宾虹,黄定华,家庭/亲属,家中钱庄、布店破产，家境窘迫，诸弟弃商，本人坚持求学,《自撰年谱稿》,不详,,,,,,,
1880年(庚辰),浙江金华书院,黄宾虹,郭子宾,收藏/鉴藏,在书院结识郭子宾，观赏其家中古画藏品,《自撰年谱稿》,不详,,,,,,,
1880年(庚辰),安徽歙县,黄宾虹,黄芸阁,学业/求学,迁居城东三牌坊，跟随黄芸阁学习科举课业,《自撰年谱稿》,不详,,,,,,,
1880年(庚辰),安徽歙县雄村,黄宾虹,曹氏,艺术/创作,观赏黄凤六《黄山异卉册》、雪庄《异卉图》，临摹并抄录题诗,自题跋文,不详,,,,,,,
1881年(辛巳),浙江金华书院,黄宾虹,无,学业/求学,时年十八岁，在书院继续修习，准备岁考,朱契《中國考試制度》,不详,,,,,,,
1882年(壬午),浙江永康,黄宾虹,方景和,游历/出行,跟随舅父方景和游览永康，沿途写生,《自述稿》《九十雜述》,不详,,,,,,,
1882年(壬午),浙江云山、福建汀州,黄宾虹,黄崇惺,游历/出行,秋季游览云山，前往福建探望黄崇惺，抵达后得知其病逝,黄警吾《黄賓虹在徽州》,不详,,,,,,,
1882年(壬午),安徽歙县,黄宾虹,洪荩臣、洪四果,家庭/亲属,返回歙县参加岁试，经撮合与洪荩臣长女洪四果定下婚约,《洪孺夫人行狀略述》,不详,,,,,,,
1882年(壬午),安徽黄山,黄宾虹,无,游历/出行,首次登临黄山，游览、写生并赋诗记录,黄警吾《黄賓虹在徽州》,不详,,,,,,,
1883年(癸未),新安江、南京、扬州,黄宾虹,无,游历/出行,春季从新安江出发，前往南京、扬州游学，批注各类典籍,《自叙》,不详,,,,,,,
1883年(癸未),江苏南京,黄宾虹,刘恭甫,社交/交往,在南京结识刘恭甫，切磋文艺,《虹廬畫談》,不详,,,,,,,
1883年(癸未),江苏扬州,黄宾虹,刘恭甫,收藏/鉴藏,观赏刘恭甫家中书画藏品,《虹廬畫談》,不详,,,,,,,
1883年(癸未),安徽歙县潭渡村,黄宾虹,无,学业/求学,翻阅家族族谱与地方旧事,《任耕感言》,不详,,,,,,,
1883年(癸未),安徽歙县,黄宾虹,汪怀之,收藏/鉴藏,获友人汪怀之赠送汉代“鹰扬将军”铜印，随身携带多年,《頻虹藏漢銅印記》,不详,,,,,,,
1884年(甲申),新安江、南京、扬州,黄宾虹,无,游历/出行,春季从新安江出发，赴南京、扬州拜师求学,《自叙》,不详,,,,,,,
1884年(甲申),江苏南京,黄宾虹,无,学业/求学,研读张庚《国朝画征录》，为书中疑点批注考证,《畫徵錄商兌》,不详,,,,,,,
1884年(甲申),江苏南京,黄宾虹,刘恭甫,社交/交往,与刘恭甫相交，获其手绘《幽亭古木图》扇面，观赏王氏兄弟画册,《虹廬畫談》,不详,,,,,,,
1885年(乙酉),新安江、南京、扬州,黄宾虹,无,游历/出行,春季再度沿新安江出行，前往南京、扬州求学,《自叙》,不详,,,,,,,
1886年(丙戌),安徽歙县,黄宾虹,无,学业/求学,改名黄质，参加岁试，考取廪生,《九十雜述》,不详,,,,,,,
1886年(丙戌),安徽歙县,黄宾虹,王养涵,社交/交往,在歙县试院结识王养涵，交流学识,题跋,不详,,,,,,,
1886年(丙戌),安徽歙县,黄宾虹,洪荩臣、洪四果,家庭/亲属,遵从父母安排，迎娶洪四果为妻,《九十雜述》《洪孺夫人行狀略述》,不详,,,,,,,
1886年(丙戌),安徽歙县紫阳书院,黄宾虹,谭献,学业/求学,在书院学习骈文、金石书画，得到山长谭献赏识,《九十雜述》,不详,,,,,,,
1886年(丙戌),安徽歙县,黄宾虹,无,收藏/鉴藏,收集汪訒庵遗留古印,《頻虹藏漢銅印記》,不详,,,,,,,
1886年(丙戌),安徽歙县,黄宾虹,无,家庭/亲属,大妹病逝,《洪孺夫人行狀略述》,不详,,,,,,,
1887年(丁亥),浙江金华,黄宾虹,黄定华、方氏、洪四果,家庭/亲属,护送妻子返回洪坑，父母迁居金华,黄警吾《黄賓虹在徽州》,不详,,,,,,,
1887年(丁亥),江苏扬州,黄宾虹,程桓,收藏/鉴藏,寄居姻亲程桓宅邸，低价收购元明书画近三百件,汪谱,不详,,,,,,,
1887年(丁亥),江苏扬州,黄宾虹,陈崇光,艺术/创作,欣赏陈崇光书画，心生仰慕，因其患病未能拜师,《論畫長札》《數奇之士》,不详,,,,,,,
1888年(戊子),新安江、扬州、金陵,黄宾虹,程石洲,游历/出行,与程石洲一同从新安江前往扬州、金陵，结交文人雅士,《散稿》,不详,,,,,,,
1888年(戊子),江苏扬州平山堂,黄宾虹,无,游历/出行,受邀在平山堂宴饮，游览当地名胜,《散稿》,不详,,,,,,,
1888年(戊子),江苏金陵,黄宾虹,甘元焕、杨长年、杨仁山,社交/交往,在金陵与诸位学人交往，研习儒学、佛学、舆地之学,《九十雜述》,不详,,,,,,,
时间,地点,核心人物,相关人物,事件类型,事件描述,原文出处,页码/位置,,,,,,,
1888年(清德宗光绪十四年戊子),江苏金陵,黄宾虹,甘元焕、杨长年、杨仁山,社交/交往,在金陵期间结识甘元焕、杨长年、杨仁山等学人，交流儒学、佛学、舆地等学问,存考资料,不详,,,,,,,
1888年(清德宗光绪十四年戊子),浙江杭州,黄宾虹,金德鉴,社交/交往,年末途经杭州，拜访收藏家金德鉴，互相观赏、交换书画藏品,汪谱、王谱,不详,,,,,,,
1889年(清德宗光绪十五年己丑),浙江金华,黄宾虹,黄定华,家庭/亲属,金华商业彻底衰败，父亲决定放弃经营,《歙潭渡黄氏先德录》,不详,,,,,,,
1889年(清德宗光绪十五年己丑),浙江金华、安徽歙县潭渡村,黄宾虹,黄赓、黄赞、两位妹妹,家庭/亲属,举家迁回原籍歙县潭渡村；安排二妹、三妹前往郑、金两家做童养媳，留四弟黄赞在金华经商,黄警吾《黄賓虹在徽州》,不详,,,,,,,
1889年(清德宗光绪十五年己丑),浙江绍兴、温州,黄宾虹,无,游历/出行,游览绍兴兰亭、青藤书屋，又至温州江心屿，赋诗作画记录行程,王谱,不详,,,,,,,
1889年(清德宗光绪十五年己丑),安徽歙县,黄宾虹,汪仲伊、汪福熙、汪律本,学业/求学,师从汪仲伊研习学问，课余与汪福熙、汪律本一同研讨书画、习琴练剑,汪谱,不详,,,,,,,
1889年(清德宗光绪十五年己丑),安徽歙县,黄宾虹,汪律本,艺术/创作,己丑年五月，为汪律本梅竹画作题写帐眉诗词,帐眉照片,不详,,,,,,,
1889年(清德宗光绪十五年己丑),安徽歙县,黄宾虹,洪四果,家庭/亲属,长女黄映宝出生,汪谱,不详,,,,,,,
1890年(清德宗光绪十六年庚寅),安徽歙县,黄宾虹,汪仲伊,学业/求学,继续跟随汪仲伊修习学业,《民國歙縣志》,不详,,,,,,,
1890年(清德宗光绪十六年庚寅),安徽歙县,黄宾虹,黄定华,其他,父亲聘请技师，采用易水古法开设作坊制作徽墨，本人课余参与制墨各道工序,石谷风信函,不详,,,,,,,
1891年(清德宗光绪十七年辛卯),安徽歙县,黄宾虹,汪仲伊、汪孔祁,学业/求学,师从汪仲伊，同时为其孙汪孔祁教授《四子书》与绘画,王谱、汪谱,不详,,,,,,,
1891年(清德宗光绪十七年辛卯),安徽歙县,黄宾虹,汪福熙,社交/交往,致信汪福熙，因路途与家事滞留，托其代为向长辈说明情况,往来书信,不详,,,,,,,
1891年(清德宗光绪十七年辛卯),安徽安庆、皖公山,黄宾虹,郑珊,艺术/创作,游历安庆、皖公山，拜访老画家郑珊，习得“实处易，虚处难”六字画诀,《自叙》《歙潭渡黄氏先德录》,不详,,,,,,,
1892年(清德宗光绪十八年壬辰),江苏南京,黄宾虹,无,学业/求学,放弃科举，前往南京坐馆教书，生活处境窘迫,《自述》,不详,,,,,,,
1892年(清德宗光绪十八年壬辰),江苏南京,黄宾虹,无,艺术/创作,壬辰竹醉日，作画四帧并题诗抒发心绪,拍卖图录,不详,,,,,,,
1892年(清德宗光绪十八年壬辰),江苏南京,黄宾虹,汪福熙,社交/交往,初冬汪福熙到访南京，二人相聚，黄宾虹拿出旧作八帧相赠,拍卖图录,不详,,,,,,,
1892年(清德宗光绪十八年壬辰),江苏南京,黄宾虹,汪福熙,社交/交往,九月初三致信汪福熙，托其帮忙引荐安身之处,往来书信,不详,,,,,,,
1892年(清德宗光绪十八年壬辰),江苏扬州李官人巷,黄宾虹,无,家庭/亲属,冬月中旬迁居扬州李官人巷，辗转多地心生漂泊之感,往来书信,不详,,,,,,,
1893年(清德宗光绪十九年癸巳),江苏扬州,黄宾虹,无,学业/求学,在扬州持续坐馆授课，课余坚持书画创作,《周氏聽雨樓》,不详,,,,,,,
1893年(清德宗光绪十九年癸巳),江苏扬州,黄宾虹,理卿,艺术/创作,癸巳仲春，为理卿绘制山水扇面,安徽省博物馆藏品,不详,,,,,,,
1893年(清德宗光绪十九年癸巳),江苏扬州,黄宾虹,汪福熙,艺术/创作,癸巳仲秋，为汪福熙创作山水四屏,黄山市博物馆藏品,不详,,,,,,,
1894年(清德宗光绪二十年甲午),浙江杭州,黄宾虹,赵穆,艺术/创作,途经杭州，请篆刻名家赵穆刻制多方自用印章,印章边款,不详,,,,,,,
1894年(清德宗光绪二十年甲午),江苏扬州,黄宾虹,无,艺术/创作,甲午五月，临摹元人设色山水；又临摹梅壑老人画作,汪谱,不详,,,,,,,
1894年(清德宗光绪二十年甲午),安徽歙县葛塘寺前猫山,黄宾虹,黄定华,家庭/亲属,六月听闻父亲黄定华病逝，从扬州返乡治丧，将父亲安葬于葛塘寺前猫山,《歙潭渡黄氏先德录》,不详,,,,,,,
1894年(清德宗光绪二十年甲午),安徽歙县,黄宾虹,家人,家庭/亲属,丧事完毕后，三弟、四弟、妹妹各自奔赴外地营生,黄警吾《黄賓虹在徽州》,不详,,,,,,,
1894年(清德宗光绪二十年甲午),安徽歙县,黄宾虹,无,收藏/鉴藏,守孝期间搜集地方史料、家族旧事，不惜用名瓷交换古印、书画,《頻虹藏漢銅印記》,不详,,,,,,,
1895年(清德宗光绪二十一年乙未),安徽歙县,黄宾虹,康有为、梁启超,社交/交往,居家守孝，听闻《马关条约》签订，致信康有为、梁启超表达声援,汪谱、王伯敏《黄賓虹二三事》,不详,,,,,,,
1895年(清德宗光绪二十一年乙未),安徽贵池,黄宾虹,谭嗣同、萧辰,社交/交往,夏季前往贵池，与谭嗣同彻夜交谈，探讨变法、时局与妇女放足等议题,王伯敏《黄賓虹二三事》,不详,,,,,,,
1896年(清德宗光绪二十二年丙申),安徽歙县,黄宾虹,洪四果,家庭/亲属,仍居家守孝，次女黄映班出生,汪谱,不详,,,,,,,
1897年(清德宗光绪二十三年丁酉),安徽歙县,黄宾虹,汪仲伊,艺术/创作,春季受汪仲伊嘱托，绘制《韜廬圖》并题款,画作题跋,不详,,,,,,,
1897年(清德宗光绪二十三年丁酉),安徽安庆敬敷书院,黄宾虹,于荫霖、赵尔巽,学业/求学,秋季被郡守举荐，进入安庆敬敷书院求学,《自述》《安徽省志·教育志》,不详,,,,,,,
1897年(清德宗光绪二十三年丁酉),安徽安庆,黄宾虹,无,家庭/亲属,书院薪俸微薄、物价高涨，生活十分困顿,往来书信,不详,,,,,,,
1897年(清德宗光绪二十三年丁酉),安徽歙县,黄宾虹,许大受,学业/求学,返回歙县，受聘在许宅教授许大受经史,汪谱,不详,,,,,,,
1897年(清德宗光绪二十三年丁酉),安徽歙县怀德堂,黄宾虹,黄辅之,其他,夏季典居黄辅之旧宅怀德堂，寻访、整理义田账目,《叙村居》《仁德莊義田舊聞》,不详,,,,,,,
1897年(清德宗光绪二十三年丁酉),安徽歙县,黄宾虹,谭嗣同等志士,其他,戊戌变法失败，谭嗣同等六君子遇害，作诗悼念,王伯敏《黄賓虹二三事》,不详,,,,,,,
1897年(清德宗光绪二十三年丁酉),安徽歙县,黄宾虹,洪四果,家庭/亲属,长子黄映燡出生,汪谱,不详,,,,,,,
1898年(清德宗光绪二十四年戊戌),安徽齐云山、歙县,黄宾虹,无,游历/出行,腊月从安庆返乡，途经雪后齐云山，登山游览,往来书信,不详,,,,,,,
1898年(清德宗光绪二十四年戊戌),安徽歙县,黄宾虹,无,收藏/鉴藏,返乡后收获汪訒庵旧藏六枚汉铜私印,往来书信,不详,,,,,,,
1898年(清德宗光绪二十四年戊戌),安徽安庆,黄宾虹,无,学业/求学,二月赴安庆参加敬敷书院甄别考试,《申報》,不详,,,,,,,
1898年(清德宗光绪二十四年戊戌),安徽歙县,黄宾虹,无,艺术/创作,寒冬作画四屏赠予汪福熙,往来书信,不详,,,,,,,
1899年(清德宗光绪二十五年己亥),安徽歙县许宅,黄宾虹,无,学业/求学,全年在歙县许宅授课,汪谱,不详,,,,,,,
1899年(清德宗光绪二十五年己亥),安徽歙县,黄宾虹,辉庭,艺术/创作,夏日为辉庭绘制山水纨扇,藏品题款,不详,,,,,,,
1899年(清德宗光绪二十五年己亥),安徽歙县,黄宾虹,地方官员,艺术/创作,仲秋为当地官员绘制《黄白山黄山诗意图》,藏品题跋,不详,,,,,,,
1900年(清德宗光绪二十六年庚子),安徽黄山,黄宾虹,程守蕃等,游历/出行,三月结伴出游，登临黄山，游览多日，创作画稿、诗作、游记,《黄山前海紀游》,不详,,,,,,,
1900年(清德宗光绪二十六年庚子),安徽青阳九华山,黄宾虹,无,游历/出行,初夏游览青阳九华山，写生赋诗,《九華紀游》,不详,,,,,,,
1900年(清德宗光绪二十六年),安徽芜湖、歙县,黄宾虹,无,游历/出行,原计划北行，听闻义和团起事，行至芜湖折返歙县,《任耕感言》,不详,,,,,,,
1900年(清德宗光绪二十六年庚子),安徽黟县,黄宾虹,郑书、黄牧甫,其他,参与当地团练防守，在黟县结识黄牧甫，观赏其篆刻作品,《黟山人黄牧甫印譜叙》,不详,,,,,,,
1900年(清德宗光绪二十六年庚子),安徽歙县,黄宾虹,许崇贵、郑书,其他,受歙县知县委托，与郑书一同勘察、治理丰堨堰田,《民國歙縣志》《任耕感言》,不详,,,,,,,
1900年(清德宗光绪二十六年庚子),安徽歙县,黄宾虹,无,艺术/创作,全年坚持作画，使用多款落款、别号,画作题款,不详,,,,,,,
1901年(清德宗光绪二十七年辛丑),安徽歙县潭川,黄宾虹,郑书,其他,与郑书租住潭川，督工修缮堰田、疏通水道，当年农田丰收,《任耕感言》,不详,,,,,,,
1901年(清德宗光绪二十七年辛丑),安徽歙县,黄宾虹,无,收藏/鉴藏,秋季整理平生所藏古玺、印章，辑成《濱虹集印》并撰写序言,《濱虹集印序》,不详,,,,,,,
1901年(清德宗光绪二十七年辛丑),安徽歙县,黄宾虹,无,收藏/鉴藏,购入朱寄洲旧藏双钩《碣石颂》拓本,《斯篆雙鈎本》,不详,,,,,,,
1901年(清德宗光绪二十七年辛丑),安徽歙县,黄宾虹,洪四果,家庭/亲属,次子黄映灼出生,汪谱,不详,,,,,,,
1902年(清德宗光绪二十八年壬寅),安徽歙县,黄宾虹,郑书,其他,郑书赴金陵任职后，独自打理丰堨堰田，清查并恢复宗族义田,《民國歙縣志》《任耕感言》,不详,,,,,,,
1902年(清德宗光绪二十八年壬寅),安徽歙县岑山,黄宾虹,无,游历/出行,闲暇游览岑山，就地写生,王谱,不详,,,,,,,
1902年(清德宗光绪二十八年壬寅),江苏金陵、南通,黄宾虹,无,游历/出行,打理堰田之余，往返金陵、南通两地,王谱,不详,,,,,,,
1902年(清德宗光绪二十八年壬寅),安徽歙县,黄宾虹,无,艺术/创作,画室取名石芝阁，在此创作书画,王谱,不详,,,,,,,
1904年(清德宗光绪三十年甲辰),安徽芜湖,黄宾虹,李德膏,学业/求学,协助将旅湘公学迁至芜湖并更名安徽公学，参与校务、授课,《自叙》《安徽俗話報》,不详,,,,,,,
1904年(清德宗光绪三十年甲辰),安徽芜湖,黄宾虹,许承尧等,社交/交往,作为歙县代表，参与安徽铁路公司会议,《申報》,不详,,,,,,,
1904年(清德宗光绪三十年甲辰),安徽歙县,黄宾虹,许承尧,学业/求学,受聘在新安中学堂任教，后因人事矛盾辞职,《許疑庵先生年表》,不详,,,,,,,
1904年(清德宗光绪三十年甲辰),安徽歙县,黄宾虹,汪律本、陈去病等,社交/交往,参与组建革命团体黄社，宣传新思想,地方史料,不详,,,,,,,
1904年(清德宗光绪三十年甲辰),安徽歙县,黄宾虹,无,其他,推广古法治理农田虫害,地方史料,不详,,,,,,,
